code,name,tel,address
981901,宏泰門市,(02)87804531,台北市信義區松仁路91-1號1樓
135012,統誠門市,(02)27226519,台北市信義區松高路11號B2樓
114370,松錢門市,(02)27658380,台北市信義區松隆路192號194號1樓
119054,信運門市,(02)27206815,台北市信義區松勤街100號1樓
992901,中信金門市,(02)27233163,台北市信義區松壽路3號B2樓
125211,德鄰門市,(02)27274484,台北市信義區松德路129號131號
975618,信德門市,(02)23455160,台北市信義區松德路200巷10號
976747,松義門市,(02)27274474,台北市信義區松德路271號
135942,萊福門市,(02)27279541,台北市信義區林口街48號
150837,信林門市,(02)27594375,台北市信義區虎林街222巷8號
971177,鑫吉門市,(02)87874152,台北市信義區虎林街85號
988016,嘉馥門市,(02)27592619,台北市信義區信義路六段11號
993041,松高門市,(02)27670810,台北市信義區基隆路一段141號1樓
110585,必成門市,(02)27640912,台北市信義區基隆路一段178號180號1樓
968034,國貿門市,(02)27576752,台北市信義區基隆路一段333號B3
120065,凱悅門市,(02)87864836,台北市信義區基隆路一段398號1樓
883382,昌隆門市,(02)87323266,台北市信義區基隆路二段131-4號
120515,喬治門市,(02)27329619,台北市信義區基隆路二段155號1樓
128542,中興門市,(02)27586997,台北市信義區基隆路二段22號
122212,崇德門市,(02)87324275,台北市信義區崇德街104號106號1樓
963556,興貿門市,(02)87867692,台北市信義區莊敬路178巷2號
947026,松智門市,(02)27206585,台北市信義區莊敬路325巷43號
999201,敬仁門市,(02)27207245,台北市信義區莊敬路470號
121079,新三連門市,(02)87891461,台北市信義區逸仙路42巷25號1樓
965194,信嘉門市,(02)27325703,台北市信義區嘉興街181巷21號
120353,福中門市,(02)27266631,台北市信義區福德街159號161號1樓
854580,留公門市,(02)27591442,台北市信義區福德街249號
